age_month,domain,parent_learning_goal,skill_name,why_it_matters,how_to_teach,parent_dos,parent_donts,parent_tip
43-45,independence,Encourage self-initiation.,Beginning routine tasks without reminders,Initiation shows growing independence.,Pause and allow time before prompting.,['Allow pause'],['Prompt immediately'],Space allows independence.
43-45,independence,Build awareness of daily structure.,Anticipating what comes next in the day,Anticipation supports smoother transitions.,Review the day’s order briefly each morning.,['Review daily order'],['Keep plans unclear'],Knowing what’s next reduces stress.
43-45,independence,Support independence during transitions.,Preparing materials for the next activity,Preparation builds planning skills.,Ask what is needed for the next task.,['Prompt planning'],['Prepare everything'],Planning builds confidence.
43-45,independence,Encourage cooperation with schedules.,Accepting routine changes calmly,Calm acceptance supports adaptability.,Acknowledge feelings and restate the plan.,['Acknowledge feelings'],['Argue extensively'],Calm acceptance builds resilience.
43-45,independence,Build pride in self-management.,Recognizing success in following schedules,Recognition reinforces independent behavior.,Acknowledge when schedules are followed well.,['Acknowledge success'],['Ignore effort'],Recognition strengthens habits.
43-45,independence,Support long-term routine habits.,Maintaining schedules across different settings,Consistency across settings builds reliability.,Use similar routines at home and outside.,['Keep routines consistent'],['Drop routines elsewhere'],Consistency builds independence.
43-45,parent self-care & stress management,Manage stress from social and behavioral challenges.,Recognizing stress triggered by child interactions,Awareness helps parents respond calmly instead of reactively.,Pause briefly and name the source of stress internally.,['Notice stress triggers'],['React without awareness'],Awareness comes before calm.
43-45,parent self-care & stress management,Respond calmly to defiant behavior.,Keeping voice steady during defiance,Calm responses reduce escalation and model regulation.,Lower voice volume and slow speech intentionally.,['Lower voice'],['Raise voice'],Your tone sets the tone.
43-45,parent self-care & stress management,Maintain patience during learning phases.,Allowing repeated practice without frustration,Patience supports skill mastery and emotional safety.,Remind yourself that repetition is part of learning.,['Expect repetition'],['Show irritation'],Learning takes time.
43-45,parent self-care & stress management,Avoid unhealthy comparisons.,Reframing thoughts when comparing children,Comparison increases stress and reduces confidence.,Refocus on the child’s individual progress.,['Focus on progress'],['Compare to others'],Every child grows differently.
43-45,parent self-care & stress management,Preserve emotional balance.,Using brief emotional reset techniques,Resets prevent stress buildup throughout the day.,Take short breathing or movement breaks.,['Use micro-resets'],['Ignore mounting stress'],Small resets matter.
43-45,parent self-care & stress management,Prevent emotional overload.,Reducing expectations on overwhelming days,Lower expectations protect emotional health.,Choose one priority and let others wait.,['Prioritize essentials'],['Expect perfection'],Less is enough.
43-45,parent self-care & stress management,Maintain self-compassion.,Talking to oneself with kindness after hard moments,Self-compassion reduces guilt and burnout.,Replace self-criticism with supportive statements.,['Practice self-kindness'],['Self-blame'],Kindness supports resilience.
43-45,parent self-care & stress management,Sustain emotional regulation.,Noticing early signs of emotional overload,Early detection allows timely self-regulation.,Check in with body tension and thoughts.,['Check in regularly'],['Ignore warning signs'],Early signals prevent burnout.
43-45,parent self-care & stress management,Build emotional resilience.,Seeking support during challenging phases,Support reduces isolation and stress.,Talk with a trusted adult about challenges.,['Seek support'],['Carry stress alone'],Support strengthens parents.
43-45,parent self-care & stress management,Maintain perspective during setbacks.,Viewing behavioral challenges as temporary,Perspective reduces emotional intensity.,Remind yourself that phases change with time.,['Keep perspective'],['Catastrophize'],This phase will pass.
43-45,"parental teamwork, planning & consistency",Coordinate social rules and expectations.,Agreeing on social behavior expectations,Aligned expectations prevent mixed messages in social settings.,Discuss social rules before playdates or outings.,['Align expectations'],['Assume agreement'],Alignment prevents confusion.
43-45,"parental teamwork, planning & consistency",Align behavioral guidance strategies.,Using the same behavior guidance approach,Consistency strengthens learning and emotional security.,Agree on guidance steps for common behaviors.,['Use shared strategies'],['Contradict each other'],Consistency builds trust.
43-45,"parental teamwork, planning & consistency",Plan activities collaboratively.,Coordinating daily and weekend activities together,Joint planning reduces stress and last-minute conflict.,Briefly review upcoming activities together.,['Plan together'],['Plan in isolation'],Shared planning brings calm.
43-45,"parental teamwork, planning & consistency",Reinforce predictable routines.,Keeping routines consistent across caregivers,Predictable routines support cooperation and security.,Document routine steps and share them.,['Share routine steps'],['Change routines casually'],Predictability supports behavior.
43-45,"parental teamwork, planning & consistency",Support each other’s parenting role.,Backing each other’s decisions publicly,Unified support prevents boundary testing.,"Address disagreements privately, not in front of the child.",['Support publicly'],['Undermine decisions'],Unity strengthens boundaries.
43-45,"parental teamwork, planning & consistency",Improve communication during busy days.,Sharing quick updates about the child,Timely updates prevent misunderstandings.,Exchange key notes during handovers.,['Share updates'],['Assume the other knows'],Brief updates prevent issues.
43-45,"parental teamwork, planning & consistency",Maintain alignment as needs change.,Revisiting parenting plans regularly,Regular review keeps responses consistent.,Schedule short alignment check-ins.,['Review plans'],['Let plans drift'],Alignment needs maintenance.
43-45,"parental teamwork, planning & consistency",Reduce tension after disagreements.,Repairing alignment after conflicts,Repair restores emotional safety and consistency.,Acknowledge differences and reset shared decisions.,['Repair quickly'],['Hold resentment'],Repair strengthens teamwork.
43-45,"parental teamwork, planning & consistency",Ensure consistent follow-through.,Following through on agreed consequences,Consistent follow-through reinforces learning.,Confirm consequences together before enforcing them.,['Follow through'],['Change consequences mid-way'],Follow-through builds credibility.
43-45,"parental teamwork, planning & consistency",Sustain long-term parenting partnership.,Reinforcing shared parenting values,Shared values guide consistent decisions over time.,Revisit core parenting values periodically.,['Revisit values'],['Let values drift'],Values anchor teamwork.
46-48,feeding,Support healthy food choices.,Choosing healthier options when given a choice,Choice-based decisions build long-term healthy eating habits.,Offer two healthy options and let the child choose.,['Offer healthy choices'],['Decide every choice'],Choice builds ownership.
46-48,feeding,Encourage awareness of nutritious foods.,Identifying foods that help the body grow,Understanding benefits supports healthier decisions.,"Explain simply how foods help muscles, bones, or energy.",['Explain benefits simply'],['Use fear-based talk'],Knowledge guides choices.
46-48,feeding,Reduce dependence on processed foods.,Accepting home-cooked meals regularly,Regular home meals improve nutrition balance.,Serve familiar healthy foods consistently.,['Serve consistently'],['Replace meals with snacks'],Consistency builds acceptance.
46-48,feeding,Build balanced plate habits.,Including fruits or vegetables at meals,Balanced plates support overall health.,Add one fruit or vegetable to every meal.,['Include produce daily'],['Treat vegetables as optional'],Balance matters daily.
46-48,feeding,Encourage mindful eating.,Eating meals without distractions,Mindful eating supports appetite regulation.,Keep meals screen-free and calm.,['Remove screens'],['Distract to increase intake'],Focus supports fullness cues.
46-48,feeding,Support self-regulation at meals.,Stopping eating when feeling full,Self-regulation prevents overeating.,Ask how the tummy feels during meals.,['Check fullness cues'],['Insist on finishing'],Trust appetite signals.
46-48,feeding,Encourage healthy snack habits.,Choosing nutritious snacks independently,Healthy snacks support steady energy.,Stock accessible shelves with healthy options.,['Prepare healthy snacks'],['Leave only junk options'],Environment shapes choices.
46-48,feeding,Build hydration awareness.,Choosing water when thirsty,Water supports digestion and focus.,Offer water regularly and model drinking it.,['Model water intake'],['Offer sugary drinks routinely'],"Water first, always."
46-48,feeding,Reduce food-related power struggles.,Eating meals without negotiating bites,Neutral meals reduce stress and resistance.,Serve balanced meals without bargaining.,['Stay neutral'],['Negotiate every bite'],Neutrality builds trust.
46-48,feeding,Maintain positive attitudes toward food.,Talking neutrally about healthy foods,Neutral language prevents food anxiety.,Describe foods without labeling them good or bad.,['Use neutral language'],['Moralize food'],Calm talk builds healthy habits.
46-48,sleep,Maintain stable sleep routines.,Following the same bedtime routine nightly,Consistency signals the body it is time to rest.,Keep bedtime steps in the same order every night.,['Keep routines consistent'],['Change routines frequently'],Routine builds sleep security.
46-48,sleep,Encourage independent sleep initiation.,Falling asleep without parental presence,Independent sleep supports uninterrupted rest.,Say goodnight and leave while the child is awake.,['Leave while awake'],['Stay until asleep'],Independence supports better sleep.
46-48,sleep,Support emotional readiness for bedtime.,Settling emotions before going to bed,Emotional calm helps the body relax into sleep.,Include calm talking or reading before bed.,['Create calm time'],['Allow high stimulation'],Calm minds sleep better.
46-48,sleep,Reduce bedtime resistance.,Going to bed without repeated protests,Reduced resistance prevents bedtime stress.,Give advance warnings before bedtime.,['Give time warnings'],['Surprise bedtime'],Predictability reduces protests.
46-48,sleep,Maintain consistent sleep timing.,Going to bed at a consistent time,Regular timing supports healthy circadian rhythm.,Set and follow a fixed bedtime daily.,['Keep bedtime fixed'],['Shift bedtime often'],Timing trains the body.
46-48,sleep,Support overnight independence.,Returning to sleep after brief awakenings,Self-soothing supports full-night rest.,Offer brief reassurance without staying long.,['Keep reassurance brief'],['Fully engage at night'],Night calm supports sleep.
46-48,sleep,Encourage responsibility for sleep needs.,Preparing sleep environment independently,Preparation builds ownership of sleep routines.,Let the child arrange pillows or comfort items.,['Allow preparation'],['Do everything for them'],Ownership builds cooperation.
46-48,sleep,Reduce dependence on sleep props.,Sleeping without extra comfort items,Fewer props support consistent sleep across settings.,Gradually reduce reliance on extra items.,['Reduce gradually'],['Remove suddenly'],Gradual change works best.
46-48,sleep,Support calm morning transitions.,Waking up calmly at routine time,Calm mornings support better daily regulation.,Wake gently and keep mornings predictable.,['Wake gently'],['Rush mornings'],Calm mornings start good days.
46-48,sleep,Reinforce positive sleep behaviors.,Taking pride in sleeping independently,Pride motivates continued healthy sleep habits.,Acknowledge successful independent sleep.,['Acknowledge success'],['Ignore progress'],Recognition builds confidence.
46-48,hygiene,Build full bathroom independence.,Using the toilet independently,Independent toilet use supports confidence and self-care.,Ensure easy access to the toilet and provide privacy.,['Encourage independence'],['Hover unnecessarily'],Privacy builds confidence.
46-48,hygiene,Support complete toileting routine.,Flushing the toilet after use,Completing steps reinforces responsibility.,Model flushing as part of the routine.,['Model the routine'],['Skip steps'],Finish every step.
46-48,hygiene,Encourage hygiene awareness.,Washing hands independently after bathroom use,Handwashing prevents illness and builds hygiene habits.,Keep soap accessible and use visual reminders.,['Keep supplies reachable'],['Wash hands for the child'],"Hands clean, germs gone."
46-48,hygiene,Improve thorough handwashing.,Using soap and rinsing completely,Thorough washing removes germs effectively.,Teach rubbing hands together for the length of a short song.,['Use a handwashing song'],['Rush washing'],Time makes hands cleaner.
46-48,hygiene,Support drying routines.,Drying hands properly after washing,Dry hands prevent spreading germs.,Show how to dry hands fully with a towel.,['Model drying'],['Leave hands wet'],Dry hands finish the job.
46-48,hygiene,Encourage bathroom responsibility.,Putting toilet seat and lid back properly,Responsibility keeps the bathroom clean.,Add this step to the bathroom checklist.,['Include in routine'],['Ignore mess'],Care for shared spaces.
46-48,hygiene,Build awareness of cleanliness.,Noticing when hands or clothes are dirty,Awareness supports timely hygiene actions.,Ask the child to check if hands look clean.,['Prompt self-check'],['Correct silently'],Awareness builds habit.
46-48,hygiene,Encourage help-seeking when needed.,Asking for help during bathroom tasks,Asking appropriately prevents accidents.,Reassure the child that asking for help is okay.,['Welcome help requests'],['Shame mistakes'],Help is part of learning.
46-48,hygiene,Maintain consistency across settings.,Following bathroom routines outside the home,Consistency prevents regression.,Review bathroom steps before outings.,['Review steps'],['Allow skipping routines'],Routines travel with the child.
46-48,hygiene,Encourage pride in independence.,Recognizing successful bathroom independence,Recognition reinforces self-care habits.,Acknowledge independence without overpraise.,['Acknowledge effort'],['Ignore success'],Confidence grows through recognition.
46-48,behavior,Build self-control during daily activities.,Pausing before acting on impulses,Pausing reduces impulsive behavior and supports decision-making.,Prompt a brief pause and a breath before responding.,['Prompt pausing'],['Rush responses'],"Pause first, act next."
46-48,behavior,Support emotional regulation.,Using calming strategies independently,Independent regulation builds resilience and control.,Practice breathing or quiet breaks during calm moments.,['Practice calming tools'],['Wait for meltdown'],Practice before it’s needed.
46-48,behavior,Encourage thoughtful responses.,Choosing words instead of actions when upset,Verbal expression prevents physical reactions.,Model phrases to express feelings and needs.,['Model feeling words'],['Ignore verbal attempts'],Words guide behavior.
46-48,behavior,Build patience in waiting situations.,Waiting calmly for a turn,Waiting supports cooperation and fairness.,Use timers or cues to mark waiting time.,['Use clear cues'],['Remove waits entirely'],Waiting is a skill.
46-48,behavior,Support frustration tolerance.,Continuing effort after a mistake,Persistence builds problem-solving and confidence.,Acknowledge effort and suggest a next try.,['Acknowledge effort'],['Fix immediately'],Try again builds strength.
46-48,behavior,Encourage rule-based self-control.,Following rules without reminders,Internalized rules support independence.,State expectations once and follow through consistently.,['Be consistent'],['Repeat endlessly'],Consistency builds control.
46-48,behavior,Develop awareness of body signals.,Noticing early signs of big emotions,Early awareness prevents escalation.,Name early cues like tight fists or fast breathing.,['Name early cues'],['Wait for escalation'],Early notice prevents big reactions.
46-48,behavior,Support recovery after upset.,Returning to calm after disappointment,Recovery builds emotional resilience.,Stay present and guide calming steps.,['Stay supportive'],['Withdraw support'],Recovery matters.
46-48,behavior,Encourage self-monitoring.,Checking behavior against expectations,Self-checking supports responsible choices.,Ask brief self-check questions before actions.,['Prompt self-check'],['Monitor constantly'],Self-check builds responsibility.
46-48,behavior,Build confidence in self-control.,Taking pride in managing behavior,Pride reinforces continued self-regulation.,Acknowledge moments of good self-control.,['Acknowledge success'],['Ignore progress'],Recognition strengthens control.
46-48,language,Improve clarity in spoken sentences.,Speaking in complete sentences,Complete sentences help others understand ideas clearly.,Model full sentences and gently expand short phrases.,['Model full sentences'],['Correct harshly'],Modeling builds clarity.
46-48,language,Support clear pronunciation.,Pronouncing words clearly in conversation,Clear speech improves communication confidence.,Repeat unclear words slowly and correctly.,['Repeat clearly'],['Mock mispronunciations'],Gentle correction works.
46-48,language,Encourage organized expression.,Explaining ideas in logical order,Organized speech supports storytelling and explanations.,"Ask what happened first, next, and last.",['Use sequencing prompts'],['Rush explanations'],Order improves understanding.
46-48,language,Build confidence in speaking.,Speaking clearly in group settings,Group speaking builds social communication skills.,Encourage sharing ideas during group activities.,['Encourage gently'],['Force speaking'],Confidence grows gradually.
46-48,language,Improve listener awareness.,Adjusting speech so others can understand,Awareness supports effective communication.,Ask if the listener understood the message.,['Check understanding'],['Ignore confusion'],Clear speech considers the listener.
46-48,language,Support descriptive language.,Adding details to sentences,Details make communication richer and clearer.,"Prompt with questions like who, where, or how.",['Prompt for details'],['Accept vague replies always'],Details improve clarity.
46-48,language,Encourage appropriate volume control.,Using suitable speaking volume,Volume control supports respectful communication.,Model indoor and outdoor voice differences.,['Model voice levels'],['Yell corrections'],Model the voice you want.
46-48,language,Build sentence expansion skills.,Expanding ideas when asked follow-up questions,Expansion supports deeper conversation.,Ask open-ended questions and wait for response.,['Ask open questions'],['Answer for the child'],Wait time matters.
46-48,language,Support conversational flow.,Staying on topic while speaking,Topic maintenance supports clear conversations.,Gently redirect back to the main topic.,['Redirect gently'],['Scold off-topic speech'],Gentle guidance keeps focus.
46-48,language,Build pride in communication skills.,Recognizing clear communication success,Recognition reinforces effective speech habits.,Acknowledge when ideas are shared clearly.,['Acknowledge clarity'],['Ignore progress'],Recognition builds confidence.
46-48,cognitive,Build understanding of basic quantities.,Recognizing more and less,Quantity comparison supports early math reasoning.,Compare two small groups of objects and ask which has more.,['Use real objects'],['Use abstract drills'],Concrete examples build understanding.
46-48,cognitive,Support number recognition.,Identifying numerals 1–10,Number recognition is foundational for math learning.,"Point out numbers in books, signs, and toys.",['Point out numbers'],['Force memorization'],Casual exposure works best.
46-48,cognitive,Encourage counting accuracy.,Counting objects with one-to-one correspondence,Accurate counting prevents number confusion.,Touch each object while counting aloud together.,['Touch while counting'],['Count too fast'],Slow counting improves accuracy.
46-48,cognitive,Build understanding of order.,"Understanding first, next, and last",Order concepts support sequencing and logic.,Use daily routines to label order of actions.,['Use routine language'],['Skip sequence words'],Daily language teaches order.
46-48,cognitive,Support early addition thinking.,Combining small groups of objects,Combining sets introduces addition concepts.,Put two small groups together and count the total.,['Combine small sets'],['Use symbols early'],Hands-on comes first.
46-48,cognitive,Encourage problem-solving persistence.,Trying different ways to solve a problem,Flexibility supports strong thinking skills.,Ask what else could work when stuck.,['Encourage alternatives'],['Give answers immediately'],Thinking grows through trying.
46-48,cognitive,Build pattern awareness.,Recognizing simple patterns,Patterns are a foundation of math logic.,Create simple color or shape patterns together.,['Create simple patterns'],['Make patterns complex'],Simple patterns teach best.
46-48,cognitive,Support classification skills.,Sorting objects by one feature,Sorting builds categorization and reasoning.,Sort toys by color or size.,['Sort one feature'],['Mix many rules'],One rule at a time.
46-48,cognitive,Encourage number use in daily life.,Using numbers during play,Practical use strengthens understanding.,"Count steps, snacks, or toys during play.",['Use daily counting'],['Limit math to worksheets'],Everyday math sticks.
46-48,cognitive,Build confidence in thinking skills.,Showing pride after solving a problem,Positive emotion reinforces learning.,Acknowledge effort and solutions found.,['Acknowledge effort'],['Focus only on correctness'],Effort matters most.
46-48,motor,Develop balance and coordination.,Hopping on one foot briefly,Single-leg balance strengthens coordination and body control.,Play hopping games on soft surfaces.,['Practice hopping playfully'],['Expect long duration'],Short hops build balance.
46-48,motor,Improve dynamic balance.,Balancing while walking on a line,Balance control supports safe movement.,Draw a line on the ground and walk along it.,['Practice line walking'],['Rush movement'],Slow balance builds skill.
46-48,motor,Strengthen lower-body control.,Jumping forward with controlled landing,Controlled landings reduce injury risk.,Practice jumping and landing with bent knees.,['Model safe landing'],['Encourage reckless jumps'],Land softly for safety.
46-48,motor,Build coordination during movement.,Alternating feet while hopping,Alternating movements support bilateral coordination.,Turn hopping into a game with rhythm.,['Use rhythmic play'],['Correct harshly'],Rhythm supports coordination.
46-48,motor,Encourage body awareness.,Adjusting movement to avoid obstacles,Awareness prevents falls and collisions.,Create simple obstacle courses.,['Use obstacle play'],['Overcrowd space'],Awareness improves safety.
46-48,motor,Support endurance in active play.,Sustaining hopping or balancing for longer periods,Endurance supports physical confidence.,Gradually extend play duration.,['Increase gradually'],['Push too hard'],Progress builds strength.
46-48,motor,Improve coordination with direction changes.,Changing direction while hopping or running,Direction control supports sports readiness.,Use games with start–stop and turn cues.,['Use movement cues'],['Ignore fatigue'],Control matters more than speed.
46-48,motor,Encourage confidence in physical ability.,Trying new movement challenges willingly,Confidence supports ongoing motor development.,Offer encouragement without pressure.,['Encourage effort'],['Compare to others'],Confidence grows with support.
46-48,motor,Support safety awareness during movement.,Stopping movement when signaled,Responding to stop cues prevents accidents.,Practice freeze-and-go games.,['Practice stop games'],['Yell unpredictably'],Clear cues keep play safe.
46-48,motor,Build pride in physical skills.,Recognizing successful balance or hopping attempts,Recognition motivates continued practice.,Acknowledge effort and improvement.,['Acknowledge progress'],['Ignore attempts'],Progress deserves recognition.
46-48,social,Encourage teamwork during play.,Working with peers toward a shared goal,Teamwork builds cooperation and social understanding.,Use games that require working together to finish.,['Encourage cooperation'],['Focus only on winning'],Team effort matters.
46-48,social,Support role sharing.,Taking turns in group activities,Turn-taking supports fairness and patience.,Assign simple roles that rotate during play.,['Rotate roles'],['Let one child dominate'],Everyone gets a turn.
46-48,social,Encourage collaborative problem-solving.,Suggesting ideas during group tasks,Sharing ideas builds confidence and group skills.,Ask what idea they have for the group.,['Invite ideas'],['Ignore contributions'],Ideas matter.
46-48,social,Build respect for others’ contributions.,Listening to teammates’ suggestions,Listening builds mutual respect.,Model attentive listening during play.,['Model listening'],['Interrupt frequently'],Listening builds teamwork.
